{
  "schema_version": "staging-chat-scenario.v1",
  "scenario_id": "bonding-overview-kb-question",
  "title": "Standalone bonding question stays in the knowledge-base branch",
  "description": "A general question about bonding should be answered from the clinic knowledge base without drifting into booking or reception-task flows.",
  "status": "active",
  "environment": "staging",
  "language": "pl",
  "tags": [
    "knowledge-base",
    "bonding",
    "non-booking",
    "staging-safe"
  ],
  "source": {
    "origin": "real_call",
    "references": [
      "knowledge-base/clinic-knowledge.json",
      "autonomy/runs/generated/vapi-live-autoeval/production-vapi-live-autoeval-20260406T134459Z/normalized-runs/production-019d6303-6a0a-7000-9b92-1f64136a50a8.run.v1.json"
    ]
  },
  "runner": {
    "provider": "vapi_chat",
    "max_turns": 1
  },
  "turns": [
    {
      "turn_id": "ask-bonding-overview",
      "user": "Na czym polega bonding zebow?"
    }
  ],
  "rubric": [
    {
      "criterion_id": "kb-tool-called",
      "description": "The assistant should consult the clinic knowledge base for a general bonding question.",
      "severity": "critical",
      "root_cause_hint": "general bonding questions stopped using searchKnowledgeBase",
      "rule": {
        "type": "turn_tool_called",
        "turn": 1,
        "tool_name": "searchKnowledgeBase"
      }
    },
    {
      "criterion_id": "kb-found-supported-answer",
      "description": "The knowledge-base workflow should find a supported answer for a standalone bonding overview question.",
      "severity": "high",
      "root_cause_hint": "bonding knowledge entry or search scoring drifted",
      "rule": {
        "type": "turn_tool_result_path_equals",
        "turn": 1,
        "tool_name": "searchKnowledgeBase",
        "path": "found",
        "equals": true
      }
    },
    {
      "criterion_id": "assistant-answer-mentioned-bonding",
      "description": "The assistant reply should frame bonding as part of the clinic offer, not only as a generic definition.",
      "required": false,
      "severity": "medium",
      "root_cause_hint": "bonding knowledge content drifted back to a generic explanation instead of clinic-offer framing",
      "rule": {
        "type": "turn_assistant_text_contains_all",
        "turn": 1,
        "contains_all": [
          "bonding",
          "w klinice"
        ]
      }
    },
    {
      "criterion_id": "no-availability-check",
      "description": "A pure general bonding question should not trigger an availability lookup.",
      "severity": "high",
      "root_cause_hint": "assistant is prematurely pushing bonding questions into scheduling",
      "rule": {
        "type": "tool_not_called",
        "tool_name": "checkAvailability"
      }
    },
    {
      "criterion_id": "no-booking-write",
      "description": "A pure general bonding question must not create a booking.",
      "severity": "critical",
      "root_cause_hint": "assistant attempted to book during a bonding knowledge-base flow",
      "rule": {
        "type": "tool_not_called",
        "tool_name": "createEvent"
      }
    },
    {
      "criterion_id": "no-reception-task-write",
      "description": "A pure general bonding question must not create a reception task.",
      "severity": "high",
      "root_cause_hint": "assistant routed a bonding knowledge-base question into the follow-up flow",
      "rule": {
        "type": "tool_not_called",
        "tool_name": "createReceptionTask"
      }
    }
  ]
}
