{
  "schema_version": "staging-chat-scenario.v1",
  "scenario_id": "root-canal-pricing-kb-question",
  "title": "Root-canal pricing question stays in the knowledge-base branch",
  "description": "The caller asks about the cost of root-canal treatment. The assistant should answer from the knowledge base, explain that the quote is individual and consultation-dependent, and avoid drifting into scheduling or handoff flows.",
  "status": "active",
  "environment": "staging",
  "language": "pl",
  "tags": [
    "knowledge-base",
    "pricing",
    "endodontics",
    "staging-safe"
  ],
  "source": {
    "origin": "manual_regression",
    "references": [
      "knowledge-base/clinic-knowledge.json",
      "knowledge-base/sources/reception-feedback-2026-03-21.md"
    ]
  },
  "runner": {
    "provider": "vapi_chat",
    "max_turns": 1
  },
  "turns": [
    {
      "turn_id": "ask-about-root-canal-pricing",
      "user": "Ile kosztuje leczenie kanalowe?"
    }
  ],
  "rubric": [
    {
      "criterion_id": "kb-tool-called",
      "description": "The assistant should consult the knowledge base for the root-canal pricing question.",
      "severity": "critical",
      "root_cause_hint": "pricing question branch stopped using searchKnowledgeBase",
      "rule": {
        "type": "turn_tool_called",
        "turn": 1,
        "tool_name": "searchKnowledgeBase"
      }
    },
    {
      "criterion_id": "kb-answer-found",
      "description": "The knowledge base should return a supported answer for root-canal pricing.",
      "severity": "high",
      "root_cause_hint": "root-canal pricing entry or retrieval scoring drifted",
      "rule": {
        "type": "turn_tool_result_path_equals",
        "turn": 1,
        "tool_name": "searchKnowledgeBase",
        "path": "found",
        "equals": true
      }
    },
    {
      "criterion_id": "assistant-answer-mentions-individual-quote-and-consultation",
      "description": "The assistant reply should mention individual quotation and the need for consultation.",
      "required": false,
      "severity": "medium",
      "root_cause_hint": "assistant surfaced the root-canal answer incompletely",
      "rule": {
        "type": "turn_assistant_text_contains_all",
        "turn": 1,
        "contains_all": [
          "indywidual",
          "konsult"
        ]
      }
    },
    {
      "criterion_id": "no-availability-check",
      "description": "A pricing question must not trigger scheduling immediately.",
      "severity": "high",
      "root_cause_hint": "assistant pushed the pricing question into the booking branch",
      "rule": {
        "type": "tool_not_called",
        "tool_name": "checkAvailability"
      }
    },
    {
      "criterion_id": "no-booking-created",
      "description": "A pricing-only question must not create a booking.",
      "severity": "critical",
      "root_cause_hint": "assistant attempted to createEvent during a pricing question",
      "rule": {
        "type": "tool_not_called",
        "tool_name": "createEvent"
      }
    }
  ]
}
