{
  "schema_version": "staging-chat-scenario.v1",
  "scenario_id": "alternative-day-refresh-availability",
  "title": "Alternative-day ambiguity refreshes availability after correction",
  "description": "The caller starts with a Tuesday-or-Wednesday afternoon preference and explicitly confirms it is the first visit. The assistant may pick one candidate day first, but after the caller corrects to Wednesday it must issue a fresh checkAvailability call instead of reusing stale Tuesday availability.",
  "status": "active",
  "environment": "staging",
  "language": "pl",
  "tags": [
    "edge-case",
    "ambiguous-input",
    "clarification",
    "staging-safe"
  ],
  "source": {
    "origin": "repo_audit",
    "references": [
      "configs/vapi/assistant.v2.json",
      "autonomy/scenarios/staging/ambiguous-day-correction.v1.json"
    ]
  },
  "runner": {
    "provider": "vapi_chat",
    "max_turns": 2
  },
  "turns": [
    {
      "turn_id": "give-alternative-days",
      "user": "Chcialbym umowic pierwsza konsultacje, to moja pierwsza wizyta, najlepiej we wtorek albo srode tak mniej wiecej po lunchu."
    },
    {
      "turn_id": "correct-to-wednesday",
      "user": "To srode po poludniu."
    }
  ],
  "rubric": [
    {
      "criterion_id": "two-availability-lookups",
      "description": "The assistant should issue a second availability lookup after the caller picks Wednesday.",
      "severity": "critical",
      "root_cause_hint": "assistant is not refreshing availability after the caller changes the preferred day",
      "rule": {
        "type": "tool_call_count_at_least",
        "tool_name": "checkAvailability",
        "min": 2
      }
    },
    {
      "criterion_id": "first-lookup-uses-afternoon-window",
      "description": "The first lookup should preserve the afternoon window.",
      "severity": "medium",
      "root_cause_hint": "time preference normalization drifted for phrases such as po lunchu",
      "rule": {
        "type": "turn_tool_arg_equals",
        "turn": 1,
        "tool_name": "checkAvailability",
        "path": "timePreference",
        "equals": "afternoon"
      }
    },
    {
      "criterion_id": "second-lookup-uses-afternoon-window",
      "description": "The refreshed Wednesday lookup should preserve the afternoon window.",
      "severity": "critical",
      "root_cause_hint": "assistant lost the time window after the caller corrected the day",
      "rule": {
        "type": "turn_tool_arg_equals",
        "turn": 2,
        "tool_name": "checkAvailability",
        "path": "timePreference",
        "equals": "afternoon"
      }
    },
    {
      "criterion_id": "requested-date-updated-after-correction",
      "description": "The second availability request should change the requested date after the caller picks Wednesday.",
      "severity": "medium",
      "root_cause_hint": "assistant kept the stale day even after the caller corrected it",
      "rule": {
        "type": "tool_arg_changed_between_turns",
        "tool_name": "checkAvailability",
        "path": "requestedDate",
        "turn_a": 1,
        "turn_b": 2
      }
    },
    {
      "criterion_id": "no-booking-created",
      "description": "This ambiguity-resolution scenario must not create a booking.",
      "severity": "high",
      "root_cause_hint": "assistant advanced into createEvent before the caller selected a slot",
      "rule": {
        "type": "tool_not_called",
        "tool_name": "createEvent"
      }
    }
  ]
}
